{
  "$schema": "http://json-schema.org/draft-07/schema#",
  "$id": "deep-spec-findings-schema.json",
  "title": "Deep Spec normalized findings (contract 2)",
  "description": "Per-backend verification result file, written to <record>/<phase>/<stage>/deep-spec-verify/<backend>.json. Canonically sorted, byte-deterministic for a given IR and environment. Nothing is silently dropped: every obligation or scenario a backend did not check appears in skipped[] with a reason.",
  "type": "object",
  "required": ["backend", "irVersion", "irHash", "method", "findings", "skipped"],
  "additionalProperties": false,
  "properties": {
    "backend": {
      "type": "string",
      "pattern": "^[a-z][a-z0-9-]*$",
      "description": "Backend identifier; equals the findings file basename without .json."
    },
    "irVersion": {
      "type": "string",
      "pattern": "^(0|[1-9][0-9]*)\\.(0|[1-9][0-9]*)\\.(0|[1-9][0-9]*)$",
      "description": "irVersion of the consumed IR document."
    },
    "irHash": {
      "type": "string",
      "pattern": "^[0-9a-f]{64}$",
      "description": "sha256 of the canonical (key-sorted) JSON serialization of the consumed IR. Cross-checking only compares sibling findings files with an identical irHash."
    },
    "method": {
      "enum": ["exhaustive", "bounded", "simulation", "static"],
      "description": "exhaustive: full symbolic check (SMT). bounded: bounded model checking (Quint+Apalache). simulation: seeded random simulation (quint run). static: deterministic non-solver computation (reference/structure checks)."
    },
    "inputs": {
      "type": "array",
      "description": "Exact inputs this document was computed from: record-relative artifact paths with their content hashes, canonically sorted by artifact. Static (refcheck) documents MUST populate this and derive irHash from it; refinement documents MUST list every consumed model and map.",
      "items": {
        "type": "object",
        "required": ["artifact", "sha256"],
        "additionalProperties": false,
        "properties": {
          "artifact": { "type": "string" },
          "sha256": { "type": "string", "pattern": "^[0-9a-f]{64}$" }
        }
      }
    },
    "checked": {
      "type": "array",
      "description": "Check families (or targets) that ran and found nothing. Present so a clean run is distinguishable from a family that never ran (no-silence at check-family granularity).",
      "items": { "$ref": "#/definitions/targetId" }
    },
    "unavailable": {
      "type": "object",
      "required": ["reason"],
      "additionalProperties": false,
      "description": "Present when the backend could not run at all (solver missing, runtime missing, IR unreadable). The stage treats every obligation as unverified by this backend.",
      "properties": {
        "reason": { "type": "string" }
      }
    },
    "findings": {
      "type": "array",
      "items": { "$ref": "#/definitions/finding" }
    },
    "skipped": {
      "type": "array",
      "items": { "$ref": "#/definitions/skippedEntry" }
    },
    "crossChecked": {
      "type": "array",
      "description": "Which sibling backends were compared, and on which targets. Records the cross-check surface even when no disagreement was found (no-silence).",
      "items": {
        "oneOf": [
          {
            "type": "object",
            "required": [
              "backend",
              "targets"
            ],
            "additionalProperties": false,
            "properties": {
              "backend": {
                "type": "string"
              },
              "targets": {
                "type": "array",
                "items": {
                  "type": "string",
                  "pattern": "^SC-[0-9]+$"
                }
              }
            }
          },
          {
            "type": "object",
            "required": [
              "backend",
              "unit",
              "targets"
            ],
            "additionalProperties": false,
            "properties": {
              "backend": {
                "type": "string"
              },
              "unit": {
                "type": "string"
              },
              "targets": {
                "type": "array",
                "items": {
                  "type": "string",
                  "pattern": "^DSC-[0-9]+$"
                }
              }
            }
          }
        ]
      }
    }
  },
  "definitions": {
    "targetId": {
      "type": "string",
      "oneOf": [
        { "pattern": "^(OB|SC)-[0-9]+$" },
        { "pattern": "^BR[0-9]+\\.[0-9]+$" },
        { "pattern": "^(DOB|DSC|DBG|SM|TR)-[0-9]+$" },
        { "pattern": "^(component|entity|attr|unit|contract|state|check):[A-Za-z0-9_./-]+$" }
      ]
    },
    "finding": {
      "type": "object",
      "required": ["kind", "frRefs", "targets", "witness", "detail"],
      "additionalProperties": false,
      "properties": {
        "kind": {
          "enum": [
            "conflict",
            "completeness-gap",
            "scenario-violation",
            "cross-check-disagreement",
            "structure-invalid",
            "reference-broken",
            "consistency-mismatch",
            "unreachable",
            "redundancy",
            "refinement-violation",
            "mapping-gap"
          ],
          "description": "structure-invalid: an artifact violates its own declared well-formedness. reference-broken: an identifier does not resolve where it is declared to resolve. consistency-mismatch: two artifacts/views that must agree, disagree. unreachable: a rule/transition whose guard can never hold (dead), or a state no execution reaches within the bound. redundancy: a rule/transition provably subsumed by a sibling (same trigger, narrower guard, identical effect). refinement-violation: the design admits, reaches, or excludes what the verified requirements forbid/demand under the refinement map. mapping-gap: the refinement map leaves a requirements obligation/scenario/attribute neither mapped, waived, nor in unmapped[]. The first four kinds are the v1 solver vocabulary, unchanged."
        },
        "frRefs": {
          "type": "array",
          "items": { "type": "string" },
          "description": "FR/NFR ids implicated, sorted, deduplicated. Traces the finding back to requirements.md."
        },
        "targets": {
          "type": "array",
          "minItems": 1,
          "items": { "$ref": "#/definitions/targetId" },
          "description": "Obligation/scenario ids implicated, sorted."
        },
        "witness": {
          "oneOf": [
            {
              "type": "object",
              "required": ["model"],
              "additionalProperties": false,
              "description": "A single state (attribute path -> value) demonstrating the finding.",
              "properties": {
                "model": {
                  "type": "object",
                  "additionalProperties": {
                    "oneOf": [{ "type": "boolean" }, { "type": "integer" }, { "type": "string" }]
                  }
                }
              }
            },
            {
              "type": "object",
              "required": ["trace"],
              "additionalProperties": false,
              "description": "A step-execution trace (state sequence) demonstrating the finding.",
              "properties": {
                "trace": {
                  "type": "array",
                  "minItems": 1,
                  "items": {
                    "type": "object",
                    "additionalProperties": {
                      "oneOf": [{ "type": "boolean" }, { "type": "integer" }, { "type": "string" }]
                    }
                  }
                }
              }
            },
            {
              "type": "object",
              "required": ["core"],
              "additionalProperties": false,
              "description": "An unsat core: the minimal implicated constraint labels (obligation/background/type-bound ids).",
              "properties": {
                "core": {
                  "type": "array",
                  "minItems": 1,
                  "items": { "type": "string" }
                }
              }
            },
            {
              "type": "object",
              "required": ["refs"],
              "additionalProperties": false,
              "description": "Reproducible artifact coordinates for a structural finding: which file and which element (YAML path, table row, or heading anchor) violate the contract. A dependency cycle is one refs array listing the components in cycle order.",
              "properties": {
                "refs": {
                  "type": "array",
                  "minItems": 1,
                  "items": {
                    "type": "object",
                    "required": ["artifact", "element"],
                    "additionalProperties": false,
                    "properties": {
                      "artifact": { "type": "string" },
                      "element": { "type": "string" },
                      "value": { "type": "string" }
                    }
                  }
                }
              }
            },
            {
              "type": "object",
              "required": ["verdicts"],
              "additionalProperties": false,
              "description": "Per-backend verdicts for a cross-check disagreement (backend id -> its verdict on the shared target).",
              "properties": {
                "verdicts": {
                  "type": "object",
                  "minProperties": 1,
                  "propertyNames": { "pattern": "^[a-z][a-z0-9-]*$" },
                  "additionalProperties": { "enum": ["violated", "clean"] }
                }
              }
            }
          ]
        },
        "unit": {
          "type": "string",
          "description": "Unit-of-work this finding belongs to, when the writer aggregates over several units."
        },
        "detail": { "type": "string" }
      }
    },
    "skippedEntry": {
      "type": "object",
      "required": ["target", "reason"],
      "additionalProperties": false,
      "properties": {
        "target": { "$ref": "#/definitions/targetId" },
        "reason": {
          "enum": [
            "capability",
            "compile-error",
            "ir-version-mismatch",
            "timeout",
            "unavailable",
            "waived",
            "stale-input",
            "unrecognized-format",
            "absent-input"
          ],
          "description": "capability: outside this backend's nature/feature coverage. compile-error: could not be compiled to the backend language. ir-version-mismatch: IR major version unsupported. timeout: per-obligation or per-run budget exhausted. unavailable: solver/runtime absent. waived: a human-gated waiver in the model/map suppressed the check. stale-input: an inputs hash no longer matches the artifact on disk. unrecognized-format: the artifact region a check needs is not in a machine-readable form. absent-input: a sibling artifact the check needs does not exist."
        },
        "unit": {
          "type": "string",
          "description": "Unit-of-work this entry belongs to, when the writer aggregates over several units."
        },
        "detail": { "type": "string" }
      }
    }
  }
}
