{
  "backend": "quint",
  "irVersion": "1.0.0",
  "irHash": "7106691451957f9b3c33f9fd201865194f0a1f959e4c9a8b953dc600bb31052a",
  "method": "simulation",
  "inputs": [
    {
      "artifact": "construction/deep-spec-analysis-functional-verify/deep-spec-analysis-functional-formal-model.md",
      "sha256": "b4d8d288f174947a5f9c5c62573c23941c1212669204366200dba292fccdf787"
    },
    {
      "artifact": "construction/deep-spec-analysis-functional-verify/deep-spec-analysis-refinement-map.md",
      "sha256": "83ba67ab1d6f00aa00e834d78ce356b0655a91c5da7e5bddacc48e68401989fb"
    },
    {
      "artifact": "inception/deep-spec-analysis-verify/deep-spec-analysis-formal-model.md",
      "sha256": "8dc8848ec64bf128df9a8e730d5e3499abd2c1e9e8848d6ee5f4e9b90cfc8342"
    }
  ],
  "findings": [
    {
      "kind": "refinement-violation",
      "frRefs": [
        "FR-1"
      ],
      "targets": [
        "OB-1"
      ],
      "witness": {
        "trace": [
          {
            "ticket.phase": "new",
            "ticket.value": 0
          },
          {
            "ticket.phase": "closing",
            "ticket.value": 0
          },
          {
            "ticket.phase": "closed",
            "ticket.value": 0
          }
        ]
      },
      "unit": "u1-orders",
      "detail": "The design machine of unit u1-orders reaches a state that violates requirements obligation OB-1 under the refinement map (step trace attached): the design can execute its way out of the verified requirements."
    },
    {
      "kind": "mapping-gap",
      "frRefs": [],
      "targets": [
        "attr:order.note"
      ],
      "witness": {
        "refs": [
          {
            "artifact": "construction/deep-spec-analysis-functional-verify/deep-spec-analysis-refinement-map.md",
            "element": "units[u1-orders]"
          }
        ]
      },
      "unit": "u1-orders",
      "detail": "requirements attribute \"order.note\" is neither mapped by attrMap nor listed in unmapped[] — silence is a contract violation"
    }
  ],
  "skipped": [
    {
      "target": "OB-2",
      "reason": "capability",
      "unit": "u1-orders",
      "detail": "event simulation and enabledness are checked by the SMT refinement pass only in v1"
    },
    {
      "target": "OB-3",
      "reason": "waived",
      "unit": "u1-orders",
      "detail": "depends on the unmapped audit flag"
    },
    {
      "target": "SC-1",
      "reason": "capability",
      "unit": "u1-orders",
      "detail": "scenario replay is checked by the SMT refinement pass only in v1 (abstract constraints do not determine a concrete init)"
    },
    {
      "target": "SC-2",
      "reason": "capability",
      "unit": "u1-orders",
      "detail": "scenario replay is checked by the SMT refinement pass only in v1 (abstract constraints do not determine a concrete init)"
    },
    {
      "target": "SM-1",
      "reason": "capability",
      "unit": "u1-orders",
      "detail": "unreachable-state detection for SM-1 requires bounded mode (quint verify with Apalache); simulation cannot decide it (states: closed, closing)"
    }
  ]
}
