{
  "backend": "cross-check",
  "irVersion": "1.0.0",
  "irHash": "fab23432eb465f21f56a341c6cb32185751c938667ae78cf20a15aae11d4ac31",
  "method": "exhaustive",
  "findings": [],
  "skipped": [],
  "crossChecked": [
    {
      "backend": "quint",
      "unit": "u1-tickets",
      "targets": [
        "DSC-1"
      ]
    },
    {
      "backend": "smt",
      "unit": "u1-tickets",
      "targets": [
        "DSC-1"
      ]
    }
  ]
}
